,城市,小区名,地址,住宅类型,均价
0,sy,宏发·英里,于洪南阳湖街148号（浑河北岸南阳湖街与细河路交汇处）,住宅,6000
1,sy,轻飏小筑,浑南区银杏路28号（南京南街与金桔路交汇处）,住宅,4500
2,sy,汇邦·克莱枫丹,于洪怒江北街佛山路32号(老辽大北水源地旁),住宅,7500
3,sy,云泽经典,皇姑步云山路47号（珠江三校原址）,住宅,11000
4,sy,沈阳温馨港湾,浑南区浑南东路20号,住宅,4300
5,sy,中海寰宇天下,皇姑昆山西路75号（原车辆厂）,住宅,8500
6,sy,龙逸尊尚雅苑,于洪长江北街82号（长江北街与黄山路交汇处）,住宅,7888
7,sy,荣盛·紫提东郡,浑南区浑南东路59号（建筑大学东3公里）,住宅,5000
8,sy,依云温泉小镇,于洪于洪区红兴路804号 （蒲河西岸，临304国道）,住宅,4500
9,sy,香格里拉,沈北新区蒲河北路8号（皇第龙邸西侧）,住宅 别墅,5500
10,sy,富邦壹品天城,浑南区莫子山路700-7号（体育学院东北面）,住宅,5000
11,sy,旺力城,抚顺经济开发区沈抚大道南旺力大街东,住宅,6500
12,sy,伴山湖,浑南区世博东街53号（世博园东）,别墅,11000
13,sy,中铁丁香水岸,于洪赤山路135号（丁香湖附近）,住宅 商住,5600
14,sy,首创琥珀湾,浑南区东陵路120号（棋盘山鸟岛东500米，万科兰乔圣菲南侧，浑河北岸）,别墅,10000
15,sy,万科·润园,铁西肇工北街13号（肇工北街与北一路交汇处）,住宅,8500
16,sy,天缘云峰领地,铁西云峰南街24号(云峰街与南七马路交汇处),住宅 商住,9800
17,sy,龙湖·紫都城,大东东望街20-1号 （东北大马路与观泉路交汇北行300米）,住宅 商住,6500
18,sy,其仕·和裕,铁西保工北街26号（保工北街与北四中路交汇处）,住宅,15000
19,sy,步阳国际,沈河文化东路8号（南塔鞋城西北侧）,住宅 商住,8000
20,sy,中海国际社区,和平南京南街22号（大润发南）,住宅,9500
21,sy,郁金香湾,新民兴隆堡镇（304国道）,住宅 别墅 商住,4000
22,sy,海域·麓溪庄园,沈北新区天时街52号（大溪地生态休闲基地内）,别墅,4300
23,sy,华府丹郡·乾豪,苏家屯苏家屯南京南街1009号-C1号（南京南街与银杏路交汇处）,住宅,4600
24,sy,中粮·隆玺世家,皇姑黄河北大街52号（航空学院原址）,住宅,12000
25,sy,富海茗乔,铁西经济技术开发区浑河六街2号（沈辽路与浑河六街交汇处东南侧）,住宅,4750
26,sy,十三街区,铁西经济技术开发区13号路4甲3号（十一号街与十三号路交汇处）,住宅,4200
27,sy,依云首府,于洪黄海路45号（于洪广场西侧200米）,住宅,7600
28,sy,皇家御湾,沈北新区蒲河路5号（393路黄土坎站东行300米）,住宅,3680
29,sy,恒润·春天里,铁西经济技术开发区浑河七街8号（沈阳洪庆中学对面）,住宅,4300
30,sy,汇景新世界,和平南三好街7号（三好桥北走100米）,住宅,9000
31,sy,沈铁·金域尚城,银州铁岭火车站广场南侧,住宅,4900
32,sy,世代悦龙湾,于洪沈新路76号(黄海公园南),住宅,6700
33,sy,颐和城,浑南区香堤路199号（伯官大桥东南侧）,住宅,4300
34,sy,天水嘉苑,银州凡河新区泰山路与长江路交汇处,住宅,2900
35,sy,锦绣馨园,大东锦园路26号（北海街与珠林路交汇处）,住宅,7800
36,sy,沈阳旭辉御府,浑南区智慧大街31号（中央公园西行400米）,住宅,5500
37,sy,百荷湾三期,浑南区白塔东路9号（沈营路与三环交汇处东南侧）,住宅,6300
38,sy,天和人家,铁西兴顺街6号（近陶林居）,住宅,9000
39,sy,绿地·剑桥,抚顺经济开发区滨河路2号,住宅 别墅,4000
40,sy,凤凰花园,铁岭县铁岭县熊官屯镇,住宅,3200
41,sy,蓝山墅,苏家屯佳园路101号（本山传媒西侧）,住宅 别墅,8200
42,sy,中国郡,新民304国道与107省道交汇处,住宅 商住,4000
43,sy,中央学府,皇姑宁山中路35号（宁山中路与金川江街路口）,住宅 商住,12800
44,sy,梦想·天成,铁西沈新路75-2号 (沈新路与开发大道交汇处),住宅,6400
45,sy,哥本哈根二期,皇姑黄河北大街113号甲（地铁医学院站出口附近）,住宅,7000
46,sy,水晶蓝湾,沈北新区沈北路60号（国土督察局沈阳局对面）,住宅,4800
47,sy,隆河谷一期,浑南区白塔街26号（白塔公园西北侧）,别墅,11000
48,sy,保利十二橡树庄园,浑南区双园路108号 （盛京高尔夫东1500米）,别墅,15000
49,sy,唐轩首府,沈北新区沈北路16号（道义大街与沈北开发大道交汇处）,住宅,5500
50,sy,世外桃源,辽中京沈高速公路高花服务区出口西侧（京沈高速与潘乌线交汇处）,住宅,5700
51,sy,富润阳光,和平昆明南街77号（SK大厦西侧）,住宅,9000
52,sy,特变·水木融城,铁西经济技术开发区22路16号（沈阳工业大学南门旁）,住宅,5300
53,sy,城南春晓,浑南区塔南街501号（沈营大街与全运路交汇处西北侧）,住宅,4800
54,sy,富力·塞戈维拉,浑南区凤凰大街77号（机场高速桃仙出口南500米）,别墅,11000
55,sy,沈阳·五彩阳光城,于洪西江北街155号（造化街道旺牛村）,住宅,6500
56,sy,龙之梦·畅园,大东滂江街62号（原沈阳矿山机械厂）,住宅,9000
57,sy,天洁·华尔街广场,浑南区浑南东路439号（沈抚大道和三环交汇处）,住宅,4500
58,sy,佳兆业中心,沈河青年大街173号（青年大街与文萃路交汇口）,住宅,13000
59,sy,天润广场,大东津桥路7号（津桥路和大什字街交汇处）,住宅 商住,11000
60,sy,唐轩英郡三期·佳境,新民胡台新城振兴七街与102国道交汇处,住宅,3800
61,sy,丽晶公馆,于洪黄河北大街108号（乐天玛特北）,住宅,7200
62,sy,瑞家·坚果,大东东北大马路钢泉巷2号（东北大马路与观泉路交汇处南侧）,住宅,7100
63,sy,沈阳世界温泉部落（一期）美国郡,新民兴隆堡镇,住宅 别墅 商住,5500
64,sy,宝能水岸康城,于洪西江北街307号（蒲河大道与沈于路交汇处）,住宅,4300
65,sy,彤利紫竹茗郡二期,大东南卡门路24号（九一八纪念馆北800米）,住宅,6000
66,sy,坤博幸福城,沈北新区沈北路108号（虎石台大街与沈北路交汇处）,住宅,3999
67,sy,长堤湾,苏家屯南京南街1066号（恒大名都公交站附近）,住宅,4500
68,sy,首开国风润城,沈北新区虎石台南大街57号（183路公交站点）,住宅,4100
69,sy,香槟新坐标,沈北新区沈北路1甲号(威德焊接对面),住宅,5100
70,sy,河畔公馆,浑南区朗云街6-88号(富民桥东侧),住宅,15000
71,sy,瑞家景峰,大东东北大马路钢泉巷1号（东北大马路与观泉路路口南）,住宅,6800
72,sy,小石城梦想小镇,浑南区红椿东路2甲-111号（沈营路与全运北路交汇处西行500米）,住宅,5200
73,sy,俪兹国际花园,和平同泽南街199号（砂山公园北侧）,住宅,9500
74,sy,奥玛丽都,铁西沈辽西路380号（大潘镇汽配中心附近）,住宅,4600
75,sy,澳海·7号公馆,铁西经济技术开发区开发大路9号（开发大道与七号街交汇处）,住宅,5300
76,sy,亿海阳光,皇姑明廉路88号（一环旁向工街与明廉路交汇处）,住宅,6400
77,sy,格林·繁荣里,新民胡台镇振兴八街47号（胡台镇花牛堡子小学附近）,住宅,3200
78,sy,中海康城·橙郡,浑南区沈中大街26号(沈中大街与双深路交汇处),住宅,5700
79,sy,恬园,皇姑宁山西路1号（书香人家东侧）,住宅,8000
80,sy,步阳江南甲第,沈北新区道义南大街22号（华润万家南行100米）,住宅,5800
81,sy,梦想e居,和平长白四街216号（三好桥下桥南侧500米长安佳园门市）,住宅,7600
82,sy,名仕雅居,浑南区大羊安村980号（沈阳体育学院东侧）,住宅,4500
83,sy,东正御泉名邸,新民兴隆堡镇,住宅 别墅,3880
84,sy,金地檀悦,大东东望北街2号（东北大马路与观泉路交汇处北行800米）,住宅,6300
85,sy,国王湖,浑南区世博东街69号（世博园东墙外）,别墅,10000
86,sy,中铁瑞达广场,和平胜利南街56号 （南五马路与胜利大街交汇处）,住宅 商住,11000
87,sy,城建南郡,浑南区汇泉东路5号（理工大学东200米）,住宅,6500
88,sy,万寿里,沈河沈河区小西路36号（18中学对面）,住宅,10000
89,sy,黎明金叶新苑,和平砂川街65号（砂南路与胜利大街交汇处）,住宅,8000
90,sy,滨河湾,于洪细河南路155号(细河路与汪河路交界处),住宅,5600
91,sy,听雨观澜,浑南区桃仙大街6号(万豪沿青年大街南行，沈阳市委市政府下道口即是),住宅,5300
92,sy,万恒愿景,大东沈铁路94号（骨科医院附近）,住宅,7100
93,sy,宏亚竖琴湾,铁西中央大街20甲2号(工人文化宫对面),住宅,5000
94,sy,弘泽锦城,铁西沈辽西路381号（奥玛丽都南侧）,住宅,5000
95,sy,方大上上城,抚顺经济开发区高顺路,住宅,4000
96,sy,瑞士风情小镇三期铂邸,于洪吉力湖街240号（铁西区和于洪新城连接处）,住宅,7500
97,sy,金地棕榈岛,浑南区学城路18号（南堤东路长青桥东900米）,住宅,7500
98,sy,儒林庭枫,新民新民胡台新城102国道南侧（胡台中学原址）,住宅,3900
99,sy,V街区,铁西经济技术开发区十四号路20号（远大家园西侧）,住宅,4800
100,sy,天著国际温泉休闲度假地,本溪市本溪满族自治县温泉寺,住宅,4300
101,sy,中集车辆园,于洪永安商贸经济区(红旗台高速口西侧，304国道与中央大街交汇处),住宅 商住,3800
102,sy,嘉润·香麓山,沈北新区人和街168号（花园一号西侧）,别墅,12000
103,sy,碧桂园公园里,浑南区白塔河路57-2号 （上亿广场旁）,住宅,7088
104,sy,越秀·岄湖郡,沈北新区蒲河北路6-61号（人和街与蒲北路交汇处）,别墅,9000
105,sy,越秀·星汇蓝海,和平胜利南街356号（胜利大街与长白五路交汇处北侧）,住宅,6500
106,sy,新希望·紫檀山,浑南区东陵东路86号（靠近方迪山庄）,别墅,12000
107,sy,东亚优立方,铁西建设西路9号（地铁一号线启工街B出口）,住宅 商住,9800
108,sy,东方欧博城,大东望花中街99号（西邻望花大街，紧靠二环）,住宅,7500
109,sy,万科铁西蓝山,铁西卫工北街42号（卫工街与北三路交汇处）,住宅 商住,10000
110,sy,三隆熙湖枫景,铁西经济技术开发区南十三号路6号8号（熙湖公园附近）,住宅,4900
111,sy,沈阳孔雀城英国宫,苏家屯孔雀杉路35号（中央大街花树湾公园内）,住宅 别墅,3600
112,sy,居易·V公寓,大东滂江街35号（龙之梦购物中心对面）,住宅,8500
113,sy,富顿公馆,铁西经济技术开发区花海路7号（地铁一号线张士地铁口附近）,住宅,5500
114,sy,保利香槟国际,沈河东陵路28号（奔驰4S店北侧）,住宅,7500
115,sy,城市玫瑰园,和平西安街181号（砂阳小区北侧）,住宅,8500
116,sy,宏发·英树公馆,于洪吉力湖街213号（沈辽路与保工街路口南行500米）,住宅,5500
117,sy,和兴·长白湾,和平长白西路39号(胜利桥南下桥500米路西),住宅,6900
118,sy,美麟阁,沈北新区蒲昌路15号（沈阳师范大学北门）,住宅,6000
119,sy,中粮·隆玺壹号,皇姑黄河北大街56号（航空学院原址）,住宅,12000
120,sy,华邑世纪城,于洪千山西路58号（怒江北街与千山西路交汇处西行700米）,住宅,6300
121,sy,金地檀府,浑南区高科路26号（地铁世纪大厦站西南300米）,住宅,9800
122,sy,沈阳国瑞城,大东东北大马路398号(联合路新28中学对面),住宅,6700
123,sy,天力城,银州莲花湖对面,住宅,4000
124,sy,壹号官邸,铁西北一东路112号（北一路与兴华北街交汇处）,别墅,20000
125,sy,玫瑰园别墅三期,浑南区桃仙大街100号,别墅,11000
126,sy,佳和新城七期,沈河方家栏路41号（紧邻二环路）,住宅,6200
127,sy,万科紫台,皇姑黄河北大街69号（乐天玛特对面）,住宅,9500
128,sy,三盛颐景御园,沈北新区蒲丰路42号（ABP总部基地东南侧约300米）,住宅,3800
129,sy,保利·茉莉公馆,和平红椿路38号（南京南街与红椿路交汇处西行100米）,住宅,5500
130,sy,亿海名都,皇姑明廉路88-7号（一环旁向工街与明廉路交汇处）,住宅,7000
131,sy,金水·花城,浑南区富民南街8号（奥体中心北行200米）,住宅,8000
132,sy,沈阳新天地,沈河文化路135-149号（文化路与南塔街交汇东南侧）,住宅 商住,9500
133,sy,万科城市之光,大东和睦北二路33号（和睦北二路与黎明四街交汇处）,住宅,9800
134,sy,棋盘山沈阳碧桂园,浑南区碧桂街10号（世博园西北侧）,住宅 别墅,5795
135,sy,金辉·尚璟,铁西浑河六街4号(沈辽路与浑河六街交汇处西南侧),住宅,4000
136,sy,信达尚城,浑南区白塔三街21号（中央公园西侧）,住宅,5200
137,sy,绿城沈阳全运村,浑南区沈中大街101-1号（绿城新都喜来登酒店东行100米）,住宅 别墅 商住,7500
138,sy,吉宝·季景沁园,沈北新区蒲新路26号（蒲新路与陵园北街交汇）,住宅,5300
139,sy,东远国际花园,大东小津桥路42-1号（天齐一巷东行200米）,住宅,8800
140,sy,国奥新城,沈北新区医大二院沈北分院北行800米,住宅,3800
141,sy,沈阳恒大江湾,浑南区浑南东路210号（浑南东路与长青南街交汇处）,住宅,5800
142,sy,新世界·名汇,和平南京南街16号（地铁1号线太原街站C出口）,住宅 商住,13000
143,sy,宝地铭郡,大东望花中街87号(望花立交桥北200米),住宅,7500
144,sy,沿海国际中心,浑南区天坛南街8号（地铁2号线营盘街站A口）,住宅 商住,9000
145,sy,首创棋盘山1号,浑南区东陵路16-18号（东陵公园对面）,别墅,8000
146,sy,金地铁西檀府,铁西沈辽路燕塞湖街30号（三隆春天酒店北行２００米）,住宅,6500
147,sy,巧克力城四期·蜜柚青城,大东沈铁路222号（大东区东北部，西起望花南街，东至联合路）,住宅,5800
148,sy,沈阳星河湾,浑南区白塔河二路120号,住宅,16000
149,sy,中天·紫金城,抚顺经济开发区总部经济7号，翔宇路与金凤街交汇处,住宅 商住,3800
150,sy,霍尔寓所,和平彩塔街50号（辽宁工业展览馆西门对面）,住宅,10000
151,sy,富力·尚悦居,大东轩兴四路20号（望花立交桥北700米）,住宅,6400
152,sy,荣盛香缇澜山,沈北新区蒲南路9号(梅江北街与浦南路交汇处西南侧),别墅,7500
153,sy,宏运·中央观邸,银州金城豫海楼下,住宅,6300
154,sy,绿色家园,浑南区桃仙大街1号（市63中学旁）,住宅,5500
155,sy,沈阳恒大名都,和平南京南街1001号（施官屯站附近）,住宅,5500
156,sy,听雨观澜宽景别墅,浑南区桃仙大街6号(万豪沿青年大街南行，沈阳市委市政府下道口即是),别墅,8500
157,sy,沈阳中体奥林匹克花园·花园新城,大东东望北街117号（东北陶瓷城东行800米）,住宅,6000
158,sy,沈阳孔雀城,苏家屯中央大街花树湾公园内,别墅 商住,6800
159,sy,唐轩城市广场,沈北新区蒲昌路1号（地铁航空航天大学站旁）,住宅 商住,6300
160,sy,御景西城,铁西沈辽东路3号（兴工南街与沈辽东路交汇处东侧）,住宅,9000
161,sy,和谐花园,铁西沈新西路80号（高明小区南侧）,住宅,4100
162,sy,绿地·国际花都,于洪赤山路55号（怒江北街与赤山路交汇处西行约800米）,别墅,12000
163,sy,万科鹿特丹,和平长白二街285-2号（长白一路北侧）,住宅,9000
164,sy,方迪山庄,浑南区东陵东路304号（鸟岛公园对面）,别墅,12000
165,sy,龙腾翰芳苑,皇姑西江街26号（皇姑热电收费大厅对面）,住宅,8500
166,sy,澳海澜庭,铁西经济技术开发区中央大街25号（中央大街与沈辽路交汇处）,住宅,5000
167,sy,金汇·温泉雅苑,新民胡台新城法哈牛镇粮库,住宅,4500
168,sy,润江华府,于洪西江北街126号（辽宁省实验中学北校西侧）,住宅,5200
169,sy,香槟蓝郡,铁西经济技术开发区沈新路127号（沈新路与抚仙湖街交汇处）,住宅,6080
170,sy,新荣大厦,和平中山路21号（中兴大厦旁）,住宅 商住,9000
171,sy,世家沈北新城,沈北新区尹家乡创业村11号（381正良站）,住宅,3580
172,sy,左岸慧晶,浑南区南堤中路9号（富民桥与长青桥之间）,住宅,9000
173,sy,中地·北纬42°,浑南区棋盘山风景区满堂街道,别墅,7000
174,sy,麓林春语,沈北新区沈北路109号（兴明街与沈北路交汇处）,住宅,5300
175,sy,麗山国际小镇,苏家屯白清寨路490号（姚千街道夹宝山村）,别墅,7000
176,sy,金沙城,于洪沙岭路70-1号（金沙岭峯东100米）,住宅,4500
177,sy,菁华名邸,银州公安大厦东侧，建委小区南侧,住宅,4500
178,sy,万科朗润园,铁西肇工北街8号 (肇工北街与北二西路交汇处),住宅 商住,8500
179,sy,万科海港城,营口鲅鱼圈金沙滩南侧,住宅,6000
180,sy,清韵百园,浑南区森林路101号（棋盘山景区入口南500米）,住宅 别墅,15800
181,sy,圣泉湾·翠堤苑,丹东凤城市东汤镇泉眼旁,住宅,3850
182,sy,玉祥·明居,于洪松山西路90号（怒江街与松山西路交汇处西行200米）,住宅,8500
183,sy,万科公园大道,于洪渤海路21-1号（太湖街与渤海路交汇处）,住宅,8500
184,sy,万科沈抚新城金域蓝湾,抚顺经济开发区沈抚路与中兴街交汇处,住宅,6500
185,sy,亚力山大城A座,沈北新区辉山大街125号（临近浅水湾）,住宅 商住,4250
186,sy,庆大·香格经典,苏家屯南京南街1088号（春蕾街与南京街交汇处）,住宅,4400
187,sy,万科春河里,沈河彩塔街16号（文艺路与三经街交汇处）,住宅 商住,17800
188,sy,万科·惠斯勒小镇,浑南区世博东街59号（世博园东1.5公里）,别墅,11000
189,sy,富兴·湖畔欣城,辽中滨水新城迎宾路与近海大街交汇处,住宅,3900
190,sy,星悦华廷,铁岭县铁岭市铁岭新城102国道与赣江路交汇处,住宅,5000
191,sy,盛世桃源,银州岭东102国道与长青路交汇处,住宅,3800
192,sy,巴厘泉乡,新民兴隆堡304国道南侧（原粮库旧址）,住宅 商住,4500
193,sy,雷凯铂院,皇姑皇姑区鸭绿江东街与银山路交汇处,住宅,6800
194,sy,明城新北市,和平皇寺路95号（市府大路与和平北大街交汇口）,住宅,11000
195,sy,古田和睦城,大东和睦路9-8号（和睦路与睦南一路之间）,住宅,9200
196,sy,假日欧洲,新民胡台镇振兴四街,住宅,3800
197,sy,永利嘉院,于洪西湖街27号（海逸诗阁购物中心附近）,住宅,5999
198,sy,唐轩·公馆,沈北新区蒲昌路1号（沈阳师范大学北）,住宅,5500
199,sy,沈阳中体奥林匹克花园·花园一号,沈北新区人和街170号（九如溪谷北侧）,别墅,8000
200,sy,国御温泉度假小镇,沈北新区常州路38号（83中对面）,住宅,4500
201,sy,城建·锦泉蓝湾,沈北新区杭州路189号（虎石台大街与杭州路交汇处）,住宅 别墅,5300
202,sy,满融公馆,苏家屯迎春北街86号（绕城高速与迎春北街交汇处西南侧）,住宅,4800
203,sy,荣盛香缇澜山二期,沈北新区蒲南路9号（蒲南路与七星大街交汇处）,住宅,4800
204,sy,广厦绿园,于洪元江街58号（丁香湖东南侧）,住宅,5500
205,sy,沈阳嘉里中心雅颂居,沈河文化路70号（青年大街与文化路交汇处东北侧）,住宅,17500
206,sy,巴黎公馆,铁西沈阳经济技术开发区沈新路59号（开发大道地铁口东300米）,住宅,7000
207,sy,唐轩北廷,沈北新区蒲新路13号（七星大街与蒲新路交汇处）,住宅,3500
208,sy,泰莱枫尚,浑南区全运路114号（全运北路与智慧大街交汇处西北侧）,住宅,4600
209,sy,格林玫瑰湾,和平长白岛长白三街6号（浑河南岸，工农桥南100米）,住宅,9000
210,sy,书香人家,皇姑宁山西路7号（八十四中学对面）,住宅 商住,8500
211,sy,浑河湾,浑南区浑南西路3号（伊丽亚特湾站附近）,住宅,5500
212,sy,阳光国际花园,沈北新区人和街125号（红太阳大药房以东）,住宅 别墅,4500
213,sy,万科柏翠园,沈河五爱街125号（五爱隧道交通岗浑河北口东侧),住宅,17000
214,sy,宝地·铭门,大东望花中街87号(望花立交桥北200米),住宅,8000
215,sy,金河湾,沈北新区沈北路208号(东北育才双语学校东侧),别墅,8000
216,sy,东方银座·莱茵城,铁西开发区二十七号路330号（西峡谷公园门口）,住宅 商住,4500
217,sy,半岛公馆,和平长白岛滨河北路68号（长白岛内河北侧）,住宅,7000
218,sy,格林阳光城,浑南区浑南东路58号（新立堡桥南西500米）,住宅,5300
219,sy,宏发·石榴,铁西沈辽西路27号(仙女湖公园内),住宅,5200
220,sy,海伦堡,皇姑淮河街17号（淮河街与宁山西路路口）,住宅,8300
221,sy,苓湖经典,铁西黔灵湖街10号（三隆世纪城西侧）,住宅,7000
222,sy,华润·幸福里,和平长白中路296号( 南京南街与长白五路交汇处),住宅,9200
223,sy,溪湖芳庭,皇姑文大路226号（方溪湖公园南200米）,住宅,5000
224,sy,华茂·央墅,浑南区全运北路70号（21世纪南行1500米）,别墅,13500
225,sy,保利大都会,皇姑北陵大街17号（北陵大街与宁山路交汇处）,住宅,9500
226,sy,沈阳龙湖香醍漫步,沈北新区蒲丰路49号（道义大街与蒲河路交汇处东行1000米）,别墅,8750
227,sy,府兴雅园,铁西北一西路27号(北一西路与北重工街交界处),住宅,5400
228,sy,雍华御景,浑南区营城子大街189号（304国道与营祝线交汇处）,住宅,5300
229,sy,万科金域华府,皇姑文大路231号（近地铁2号线沈师站）,住宅,6500
230,sy,天恒森林里,沈北新区辉山经济开发区聚农路34号（沈阳太平洋国际学校附近）,住宅,4600
231,sy,绿地大溪地,沈北新区天时街66号（天时街与沈北路交汇处）,别墅,6000
232,sy,瀚都国际,铁西兴工北街53号（沈阳站西出口50米）,住宅 商住,10000
233,sy,鑫丰·熙区府,铁西兴华北街36号（维康医院以北）,住宅,10240
234,sy,会展壹号,苏家屯南京南街1008号（南京南街西侧）,住宅 别墅,4800
235,sy,逸景盛熙城,沈北新区银河南街60号（新城子民政局后身）,别墅,6500
236,sy,御龙湾,于洪马三家中街73号（金马新村东侧）,住宅,4200
237,sy,沈阳裕景中心,沈河青年大街33-1号 (沈阳市青年大街市府恒隆广场南侧),住宅,14000
238,sy,碧水俪城,铁西北启工街8甲号（北二西路与北启工街交汇处向北200米）,住宅,6000
239,sy,尚书微公馆,于洪黄河北大街118甲号（阳光维也纳南侧）,住宅,6800
240,sy,世百居洪湖湾,于洪洪湖北街与沈大路交汇处（地铁1号线迎宾路地铁口北行700米）,住宅,7200
241,sy,中兴·和园,沈北新区蒲河路59号（东北总部基地附近）,住宅 别墅,4300
242,sy,华新名筑,浑南区白塔河路33号(智慧三街与双深路交汇处),住宅,6400
243,sy,茂业中心,沈河青年大街185号（沈阳科学宫北侧）,住宅 商住,9200
244,sy,近海城邦,辽中滨水新城近海大街与二号路交汇处,住宅,4200
245,sy,九洲御府,和平胜利大街888号（浑南大道与胜利南大街交汇处）,住宅,5600
246,sy,宝郡·盛唐雍景,于洪黄河北大街130号（何氏眼科北门对面）,住宅 商住,7500
247,sy,众邦东海明珠,大东东北大马路116-2号 （东北大马路与北海街交汇处）,住宅,9200
248,sy,凯德俪锦城·听澜郡,于洪沙岭镇玉沙街6号（经济开发区北）,住宅,3800
249,sy,美弗霞湾,浑南区智慧大街2号（信达尚城东）,住宅,5200
250,sy,嘉隆欣苑,银州铁岭市银州区光荣街南段,住宅,4500
251,sy,澳洲领地,皇姑明廉路11号（明廉路与塔湾街交汇处）,住宅,6500
252,sy,宝地城,阜新市海州区创业路35号（第七中学东侧）,住宅,3800
253,sy,中国电建·海赋外滩,东洲区小甲邦,住宅,3900
254,sy,澳海澜郡,铁西经济技术开发区沈辽西路142号（沈辽西路与浑河十五街交汇处）,住宅,4300
255,sy,加拿大郡,新民兴隆堡304国道南侧,住宅 别墅,4600
256,sy,阳光100国际新城,于洪吉力湖街28号（南阳湖大桥北侧200米）,住宅,6500
257,sy,皇家首座,沈北新区道义南大街68号（辽宁大学北侧）,住宅,6300
258,sy,泰荣湾,浑南区文溯街8号（建筑大学东200米）,住宅,7000
259,sy,华发首府,浑南区天坛南街12号（原会展中心）,住宅,10000
260,sy,丽都新城二期爱丽香舍,铁西张士开发区中央大街20号甲（中央大街地铁站D出口向南200米）,住宅,5500
261,sy,中海城,于洪西江街160号（西江街与白山路交汇处，原荷兰村）,住宅 商住,5500
262,sy,保利·白沙林语,浑南区玄菟路580号（金橙街与玄菟路交汇处西北角）,住宅,4400
263,sy,翰逸华园二期,和平长白东路17号(公路规划设计院南侧),住宅,7500
264,sy,永盛·水调歌城,于洪吉力湖街25-3号（二环旁滑翔五金城南侧）,住宅,5500
265,sy,新湖青蓝国际,铁西中央大街27号（中央大街与十四号路交汇处）,住宅,4500
266,sy,中铁·人杰水岸,沈北新区蒲河路27号（236路蒲河大道站西侧）,住宅 别墅,5300
267,sy,世茂诺丁山,浑南区森林路2号（世博园西门对面）,别墅,11000
268,sy,华润·奉天九里,浑南区恒达路2号（南堤东路与长青南街交汇处 ),住宅,8000
269,sy,宏发长岛,铁西沈辽西路27号（兴隆大天地附近）,住宅,6300
270,sy,乐天圣苑,皇姑岐山东路9号（地铁2号线岐山路站B出口）,住宅,13000
271,sy,满融首府,苏家屯迎春北街88-44号（满融国际新城2期钟楼）,住宅,4900
