,城市,小区名,地址,住宅类型,均价
0,tj,河东融科瀚棠,月牙河与昆仑路交口，河东文化公园旁 ,普通住宅,25000
1,tj,首创城,大沽南路延长线（津沽公路）洪泥河东路与吉泰路交汇处,普通住宅,12000
2,tj,路劲太阳城,凤山道与贺兰路交口,普通住宅,24000
3,tj,中海八里臺,平山道与卫津路交口,商住两用,28000
4,tj,天津全运村,洞庭路与渌水道交口,普通住宅,28000
5,tj,香缇花园,满江东道与祁连路交口（太阳城以北）,普通住宅,19800
6,tj,星河荣御,知景道155号,普通住宅,11000
7,tj,金泰丽湾,空港经济区弘顺路与华瑞路交口,普通住宅,13500
8,tj,首创大河宸章,天泰路与津浦北路向西400米处,普通住宅,30000
9,tj,合景御华园,双港镇津港高速辅路与景荔道交口,普通住宅,15000
10,tj,红星国际广场,津滨大道160号（河东红星美凯龙后侧）,公寓,12000
11,tj,兆恒广场院外SOHO,辛庄镇鑫怡路与平凡道交口（辛庄中学旁）,商住两用,15000
12,tj,熙汇广场,黄河道与快速路交口,商住两用,14500
13,tj,和泓四季恋城,津滨大道与跃进路交口,普通住宅,22000
14,tj,蘭园,黄河道与广开大街交口,商住两用,350
15,tj,星河时代,瑞景居住区龙泉道与外环辅路交口,别墅,12000
16,tj,中交樾公馆,张家窝镇京福支线与辛老路交口以南,普通住宅,43000
17,tj,鲁能公馆,天塔道(水上公园畔),普通住宅,470
18,tj,正荣润璟湾,中北镇中北大道北侧(南运河北岸),别墅,7200
19,tj,亿利华彩城,上北新区梅石路与广贤路交口,普通住宅,8500
20,tj,湯臣津湾一品,赤峰道8号,普通住宅,36000
21,tj,合景御华园,双港镇津港高速辅路与景荔道交口,别墅,360
22,tj,社会山2014,张家窝镇京福公路东侧（天津南站西侧600米）,普通住宅,15000
23,tj,凯德国贸,南京路39号(南京路与马场道交口),商住两用,28000
24,tj,东亚风尚国际,新开路西侧（育才中学对面）,普通住宅,16000
25,tj,华润橡树湾橡墅,东丽区华明镇弘泽大街与杨北公路交口,别墅,260
26,tj,融创中心,红旗路278号天拖原址,商住两用,24000
27,tj,正荣润璟湾,中北镇中北大道北侧(南运河北岸),普通住宅,17000
28,tj,红星国际广场,津滨大道160号（河东红星美凯龙后侧）,商住两用,12000
29,tj,中粮大道,九经路和六纬路交口,普通住宅,30000
30,tj,星河时代,瑞景居住区龙泉道与外环辅路交口,普通住宅,175
31,tj,首创暖山,双港镇津沽公路与梨双路交口,普通住宅,12000
32,tj,松江置嘉公寓,鞍山西道与白堤路交口,商住两用,18000
33,tj,旗锦苑,下伍旗镇中心幼儿园对面,普通住宅,3480
34,tj,燕云小镇,大东线与高王路交口京津高速泗村店出口西侧,别墅,60000
35,tj,成山公馆,和平西安道与成都道交口,普通住宅,4200
36,tj,锦绣佳苑,黄花店镇商贸街北侧,普通住宅,5600
37,tj,佳和雅庭,解放南路延长线,普通住宅,7000
38,tj,东疆国际,滨海新区东疆港亚洲路与郑州道交口处,普通住宅,13500
39,tj,海泰海港花园,临港工业区渤海十路以东，金沙江道以北,普通住宅,6900
40,tj,保利玫瑰湾薇公馆,昆仑路与满江道交口，临近卫国道,商住两用,11000
41,tj,澜海庄园,八里台镇天嘉湖欢乐岛旅游度假公园（津南区政府南侧）,普通住宅,6500
42,tj,津沽首府,咸水沽镇津沽公路与体育场交汇处北100米路东（月谭大厦对面）,普通住宅,7500
43,tj,英伦世家,宁河桥北新区规划三八河路蓟运河大桥旁,普通住宅,7700
44,tj,瓏府壹号,"蓟县渔阳镇东环路东侧,四中东面.",普通住宅,7000
45,tj,复地湖滨广场,空港经济区中环东路与东二道交口,普通住宅,11870
46,tj,天山城,津歧公路与盛塘路交汇处（小站练兵园东侧700米处）,普通住宅,7000
47,tj,龙泽馨园,宁河县卢台镇芦汉路与镇新路交口西北侧,普通住宅,8200
48,tj,万通新新逸墅,中新生态城中央大道和和睦路交口,别墅,6588
49,tj,恒大御景半岛,宁河桥北新区津榆公路北侧,普通住宅,8200
50,tj,万科东海岸,东疆湾旅游风景区,普通住宅,9000
51,tj,融科伍杄島,静海团泊湖东区中央大道与泽水北路交口,别墅,6288
52,tj,中交上东湾,东疆港东侧南至陕西道，北至延安道，西靠欧洲路，东为观澜路,普通住宅,7000
53,tj,天津碧桂园,八里台镇津港公路与八二路交口（八里台示范镇指示牌前行50米） ,普通住宅,24500
54,tj,北辰新天地盛景湾,津围公路与九园公路交口北侧北辰科技园新区永进道南侧,普通住宅,12000
55,tj,钱隆学府,北闸口镇津岐公路以东侧,普通住宅,5600
56,tj,美震瑞景时代,北辰西道双青新家园内,普通住宅,7500
57,tj,恒大绿洲,东丽湖温泉旅游度假区，东丽之光大道北侧，欢乐谷以西,普通住宅,8500
58,tj,中铁诺德名苑,河北西路与云山道交口,普通住宅,13500
59,tj,金地紫乐府,津塘路与昆仑路交口（一号桥轻轨站旁）,别墅,850
60,tj,保利梧桐语,下朱庄街天和路西侧,别墅,25000
61,tj,天津湾海景文苑,古海道和南北大街交口东南侧,普通住宅,17000
62,tj,金隅悦城,津滨大道南侧登州南路与惠山道交口（滨海耀华中学旁）,普通住宅,11000
63,tj,万科海港城,开发区时尚广场区域万科金域蓝湾以东,普通住宅,15000
64,tj,鼎泰精装公寓,十一经路和津塘路交口,普通住宅,12000
65,tj,富力津门湖,西青绥江道与江湾路交口,普通住宅,25000
66,tj,富力尚悦居,雍阳西道与翠通路交口（凯旋王国东侧）,普通住宅,15500
67,tj,渤海天易园,大寺镇赛达十支路与芦北路交口（玛歌庄园1848以南100米）,普通住宅,7488
68,tj,颐贤里,环湖东路与体院北道交口,普通住宅,30000
69,tj,花溪畔,京津公路与嘉河道交口,普通住宅,6200
70,tj,天津大都会,荣业大街76号（福安大街与荣业大街交口） ,普通住宅,25000
71,tj,沽上江南,咸水沽红旗路以东建国大街以北,普通住宅,10800
72,tj,鸿瑞锦园,崔黄口镇规划路北侧（津围公路与杨崔路交口）,普通住宅,4600
73,tj,渤海明珠,解放南路与中环线交口(天津骨科医院对过),普通住宅,17800
74,tj,盛世豪庭二期,武清区陈咀镇104国道西侧,普通住宅,5000
75,tj,橄榄郡,武清石各庄镇政府路东侧，石各庄北外环路南侧,普通住宅,4000
76,tj,世茂泊郡,中新生态城和畅路与和惠路交口,别墅,492
77,tj,京基嶺域,八里台津港公路与嶺域路交口（京基高尔夫俱乐部内）,别墅,40000
78,tj,田纳溪湖,武清大孟庄镇京津公路西侧,别墅,25000
79,tj,城厢公馆,城厢中路与鼓楼西街交口西北侧,商住两用,10000
80,tj,大成中环城,红旗北路与湘潭道交口,普通住宅,300
81,tj,贻成红墅郡,塘沽新北路与厦门南路交口,别墅,456
82,tj,滨海湖,杨北公路洪排河桥处沿滨海湖路北行（原黄港水库）,别墅,1350
83,tj,豆蔻工社,赤龙街中段津南经济开发区西区管委会南侧,商住两用,6500
84,tj,天津大都会SMART,福安大街与荣业大街交口,商住两用,30000
85,tj,景瑞花园,杨六路与京津公路交口,普通住宅,5980
86,tj,大唐印象,津汉公路与北杨线交口北侧华明新城,普通住宅,10700
87,tj,远洋五矿旷世新城,普济河东道与外环线交口（宜兴埠立交桥）向右500米处,普通住宅,11000
88,tj,四季风情,塘沽车站北路安顺道交口西行800米,普通住宅,11500
89,tj,天房郦堂,成林道与昆俞路交口处,普通住宅,14000
90,tj,依水和墅,中新生态城中新大道与经六路交口,别墅,410
91,tj,保利罗兰公馆,张家窝镇知景道东侧,别墅,540
92,tj,棉3水岸名居,海河东路国泰桥南侧200米,普通住宅,27000
93,tj,首城南湖1號,下朱庄街天和路东侧,普通住宅,7800
94,tj,南湖9号,武清区下朱庄街天湖路与藕甸道交口,普通住宅,7200
95,tj,紫盈花园,南蔡镇外环北路二号,普通住宅,5300
96,tj,榕园嘉苑,秀川路与津涞公路交口南行600米,普通住宅,12500
97,tj,天房崇德园,红旗南路263号,普通住宅,38000
98,tj,盛运大厦,大丰路与南运河南路交口,普通住宅,13500
99,tj,景瑞阳光尚城,宜兴埠立交桥延津围路向北10分钟北仓道延长线（小淀镇政府后身）,普通住宅,7100
100,tj,林语花园,大良镇廊良公路北侧，初级中学西500米,普通住宅,4700
101,tj,卓达太阳城,武清京津第二高速牛镇出口东行2公里南侧,普通住宅,8500
102,tj,美克嘉美湾,武清区京津公路与龙凤新河交汇处,普通住宅,8000
103,tj,融创中央学府,天津大道与东沽路交口,别墅,380
104,tj,京基嶺墅,八里台津港公路与嶺域路交口（京基高尔夫俱乐部内）,别墅,200
105,tj,天保美墅林,北塘经济区梅州道与阳澄湖路交口,别墅,530
106,tj,天房天和园,中新生态城中新大道1852号,普通住宅,9500
107,tj,天津华侨城桥湾,东丽湖路以西，东丽之光大道以南,普通住宅,9000
108,tj,宸峰家园,杨村镇胜利路与大桥道交口,普通住宅,7800
109,tj,信置荔城首府,强国道与翠通路交口,普通住宅,7400
110,tj,世茂新街坊,中新生态城和畅路与和惠路交口,普通住宅,9000
111,tj,招商局网谷企业街区,武清商务区滨湖路北侧福源道与新开路交汇处西南侧,商住两用,9000
112,tj,南园,津港公路与科技大道交口西南侧,别墅,180
113,tj,京津一品,京津路与柳滩路交口西南侧（天辰大厦旁）,商住两用,17000
114,tj,中央公馆,吴家窑大街19号(佟楼附近，儿童医院对过),商住两用,22000
115,tj,世茂御龙湾,咸水沽镇界河路（月坛海鲜城对面）,别墅,249
116,tj,富贾花园,中山北路17号,商住两用,22000
117,tj,天津富力中心,合肥道与南昌路交口（地铁1号线小白楼站旁）,商住两用,18500
118,tj,公馆1882,大沽北路与承德道交叉口 ,商住两用,28000
119,tj,万顺空港融和广场雅仕阁公寓,空港经济区中环西路与西五道交口,商住两用,9500
120,tj,青朗园,杨柳青镇西青道与柳口路交口处西北侧,商住两用,11500
121,tj,九策联都星城,李七庄街规划天骄道北,商住两用,7980
122,tj,世纪金三角公寓,塘沽营口道与烟台道交口,商住两用,14000
123,tj,富海公馆,中山路与日纬路交口,商住两用,20000
124,tj,克拉公馆,京津公路东侧（静湖花园西区与京津公路交口处),商住两用,7500
125,tj,南湖红星国际广场,武清天和城天和路与藕甸道交口,别墅,14000
126,tj,英伦假日,广贤路与致远道交口,别墅,16000
127,tj,滨海浙商宜居,开发区轻轨站对面(津塘公路419号),普通住宅,25000
128,tj,泰安道五大院,解放北路和保定道交口,普通住宅,44000
129,tj,欧铂城,高新大道与景丽路交口（地铁总站旁）,普通住宅,8200
130,tj,珑著,环瑞北路与龙门道交口（刘园地铁站西侧200米）,普通住宅,17500
131,tj,海上国际城,空港2号桥北津汉公路与赤海路交口,普通住宅,8000
132,tj,恒大名都,津汉公路空港2号桥华明新家园内,普通住宅,13500
133,tj,亚泰澜公馆,武清中央水城滨河道与泉雍路交口东侧,别墅,13000
134,tj,金地艺华年,双港镇梨双路与津港高速辅路交口南侧（领世郡南行450米）,别墅,350
135,tj,北大资源阅府,东丽大道与景福路交口,别墅,170
136,tj,中海复兴九里,黑牛城道与洞庭路交口 ,普通住宅,40000
137,tj,五矿榕园,津涞公路外环线出口1.2公里,普通住宅,14000
138,tj,旺海公府,海河东路与狮子林大街交口,普通住宅,37000
139,tj,雅仕兰庭,富民路与东南半环快速路海津桥交口,普通住宅,22000
140,tj,经纬城市绿洲武清二期,新开路东侧与雍和道交口（杨村一中新址南侧）,普通住宅,8000
141,tj,贻成峰景,新北路与厦门路交口,普通住宅,8500
142,tj,天地源欧筑,津歧公路与福惠园交口（北闸口二小西侧）,普通住宅,5300
143,tj,中浩智城,汊沽港京津科技谷康园道北侧，京沪高速东侧,普通住宅,5000
144,tj,泰达星海湾,临港经济区渤海十路与岷江道交口,普通住宅,6500
145,tj,翡翠蓝湾,上马台镇武宁路南侧,普通住宅,6900
146,tj,荔隆观邸,武清建设北路和南财源道交口,普通住宅,8300
147,tj,吉宝沁风御庭,中新生态城中新大道5681号,普通住宅,11500
148,tj,和骏新家园,东马圈镇政府西侧,普通住宅,5600
149,tj,恒大山水城,龙凤新城大东线北,普通住宅,7500
150,tj,星耀五洲,八里台镇天嘉湖,普通住宅,5500
151,tj,华城浩苑,北辰西道与外环西路交口向西1公里双青新家园内,普通住宅,7400
152,tj,旭辉燕南园,南奥体津涞公路旁,普通住宅,12000
153,tj,泰达御海,滨海新区北塘大街与洞庭路延长线交口,普通住宅,9000
154,tj,東壹区,开发区第二大街和太湖东路交口,普通住宅,13500
155,tj,佳宁苑,滨海新区天津港散货物流区金岸一道以南（海滨大道以西）,普通住宅,8800
156,tj,万科新梅江柏翠园,解放南路新梅江太湖路公园与卫津河公园旁,普通住宅,660
157,tj,北大资源阅城,黑牛城道与洪泽南路交口东南侧,普通住宅,30500
158,tj,天津海棠湾花园,蓟县迎宾大街南侧、凤凰山大道西侧,普通住宅,8000
159,tj,福升园,津塘公路与大连道交口,普通住宅,7383
160,tj,紫竹华庭,塘沽车站北路与赵新路交口（原车站北路赵家地居住区）,普通住宅,11500
161,tj,锦润华庭,空港经济区东八道与规划十五支路交口,普通住宅,13000
162,tj,御水园,新北公路与厦门路交口处,普通住宅,9700
163,tj,清谷,开发区学院区（第十三大街与洞庭路交口）,别墅,1036
164,tj,华润紫阳里,新华路与长春道交口（滨江道旁）,商住两用,25000
165,tj,鸿坤原乡半岛,黄庄街泉奉路西侧（武清高铁站向东2000米）,普通住宅,12000
166,tj,北辰红星国际广场,京津公路与果园南道交口,商住两用,12000
167,tj,奕聪花园,红旗南路快速路北侧,商住两用,15000
168,tj,天津诺德中心,律纬路与五马路交口西北角,商住两用,18500
169,tj,保富国际,卫津南路与绥江道交口,商住两用,12500
170,tj,米兰东湖湾,东丽区东丽湖东丽之光大道与南二道交口（东丽欢乐谷后面）,商住两用,7000
171,tj,天津华侨城天鹅堡,东丽湖路以西，东丽之光大道以南,别墅,12000
172,tj,国兴融泰城,津涞公路与秀川路交口,普通住宅,11000
173,tj,远洋心里,大连东道与港滨路交口处（市民广场轻轨站东侧）,普通住宅,13500
174,tj,金地艺华年,双港镇梨双路与津港高速辅路交口南侧（领世郡南行450米）,普通住宅,13800
175,tj,季景华庭,中新生态城和旭路与和畅路交口,普通住宅,10000
176,tj,中国铁建国际城,金钟河大街与中环线交口,普通住宅,21000
177,tj,府上和平,西安道与长沙路交口,普通住宅,50000
178,tj,观锦,普济河道和南口路交口向西500米,普通住宅,25000
179,tj,中冶德贤公馆,大沽南路与洪泽路交口(靠近中环),普通住宅,41000
180,tj,万科金域华府,津塘公路北侧，驯海路东侧,普通住宅,15500
181,tj,天房意墅,双港新家园景荔道与汇川路交口,别墅,560
182,tj,天房锦园,东丽津汉公路空港2号桥东,别墅,11000
183,tj,保利香颂湖,京津公路西侧（广贤路与四纬路交口）,普通住宅,9000
184,tj,贻海观澜,东疆自贸区观澜路以东，贺兰道以北,别墅,595
185,tj,君利名筑,下朱庄街南北辛庄桥1公里,普通住宅,7500
186,tj,金融街融汇,海泰南北大街和创新一路交口,普通住宅,19000
187,tj,中信公园城,天嘉湖大道西侧,普通住宅,5500
188,tj,首创国际半岛,京津高速永乐站收费口前行300米,普通住宅,9000
189,tj,万科民和巷,津塘公路与外环线交口,普通住宅,17500
190,tj,瑜芳园,民航大学东侧约1公里,普通住宅,9200
191,tj,尚港华府,汉沽港高王路东侧,普通住宅,4500
192,tj,富国高银,海泰华科九路16号,普通住宅,40000
193,tj,梅尚国际住区,武清区梅厂镇武宁路与津围公路交口处,普通住宅,6500
194,tj,御溪苑,广贤路与乐仁道交口西侧500米,普通住宅,9100
195,tj,枫丹天城,雍阳西道与翠亨路交汇路口西北侧,普通住宅,14500
196,tj,金侨大道,福源道与南东线交口,普通住宅,12500
197,tj,瞰海轩,东疆港保税港区宁夏道与亚洲路交口西侧,普通住宅,9000
198,tj,城建福源花园,滨海新区大港旭日路与海景九路交口(大港一中东北步行10分钟),普通住宅,6300
199,tj,御河墅,西青杨柳青元宝岛西侧,别墅,350
200,tj,世茂英郡,中新生态城起步区 ,别墅,350
201,tj,南湖红星国际广场,武清天和城天和路与藕甸道交口,普通住宅,7400
202,tj,金地艺城华府,东纵快速（铁东路）与西北半环快速（淮河道）交口,普通住宅,19000
203,tj,振业名邸,佳宁道与双环路交口东北处 ,普通住宅,18000
204,tj,东西沽现房,天津大道与闸南路交口处,普通住宅,7300
205,tj,东丽湖万科城高层,东丽湖路转东丽之光大道东丽湖万科城,普通住宅,6500
206,tj,世茂御龙湾,咸水沽镇界河路（月坛海鲜城对面）,普通住宅,8000
207,tj,格调绮园,黑牛城道与太湖路交口,普通住宅,25000
208,tj,海泰华塘名邸,北塘经济区北塘大街南侧,别墅,290
209,tj,哈兰庄园,泗村店镇龙河路西侧益兰园,别墅,10700
210,tj,唐望府,塘沽津塘公路与新北路交口处,普通住宅,35000
211,tj,首创大都滙,中山路与昆纬路交口,普通住宅,14000
212,tj,瑞奇青年汇,津沽路与赤龙街交口右转500米处,商住两用,7000
213,tj,鑫茂鑫街区公寓,杨柳青柳口路98号,商住两用,5000
214,tj,皇冠国际公寓,滨海新区空港经济区中心大道与东四道交口（景观大湖、高尔夫球场旁）,商住两用,15000
215,tj,荣域启程,双港镇鄱阳南路与睿平道交口,商住两用,8000
216,tj,拾光汇,微山南路与赤龙街交口向东前行700米,商住两用,8500
217,tj,南益名士华庭,塘沽新河街福州道延长线,普通住宅,14500
218,tj,新梅江锦秀里,解放南路东侧沂山路与渌水道交口,普通住宅,27500
219,tj,宝能城,卫国道延长线与新外环路交口（津汉公路以北，北环铁路以南）,普通住宅,9000
220,tj,万科四季花城,京福支线与辛老路交口南侧（天津南站旁）,普通住宅,14700
221,tj,旭辉澜郡,塘沽胡家园腾飞大道以北，海兴路以东,普通住宅,8800
222,tj,天房意境,双港镇新家园内景荔道与汇川路交口,普通住宅,11000
223,tj,旭辉御府,中北大道以南，海光路以西,普通住宅,17500
224,tj,宜和美墅,滨海新区中新天津生态城动漫南路,别墅,8000
225,tj,紫韵枫尚,建国南路45号（中信广场往南1000米）,普通住宅,9200
226,tj,金御瞰景,月牙河畔咸水沽一中南侧 ,普通住宅,24000
227,tj,新梅江雅境新枫尚,解放南路渌水道交口（东南侧）,普通住宅,17000
228,tj,半湾半岛,双街镇张湾双进道以南，顺达路以北,普通住宅,33000
229,tj,惠灵顿国际社区,北马路与北门外大街交口,普通住宅,30000
230,tj,天津诺德中心,律纬路与五马路交口西北角,普通住宅,8300
231,tj,天时茗苑,陈咀镇（与北辰双口交界104国道至陈咀桥500米）,普通住宅,5000
232,tj,天津津南新城,天津大道与东沽路交口,普通住宅,9500
233,tj,房信彩虹城,梨双路西南侧,普通住宅,7400
234,tj,理想城,友谊南路与梨双路交口,普通住宅,12500
235,tj,恒益隆庭,精武镇（南河镇）荣华道南侧,普通住宅,8800
236,tj,金泰丽舍,京津高铁武清站东南500米,普通住宅,12000
237,tj,泽信金汇湾,武清新城京津公路东运通广场北侧（武清客运站对面）,普通住宅,8000
238,tj,天鹅湖1号,广源道南侧,普通住宅,7000
239,tj,米兰阳光,咸水沽镇建国大街与津沽公路交口,普通住宅,8300
240,tj,幸福公里,北辰西道双青新家园内，地铁刘园站西侧1000米,普通住宅,7500
241,tj,柴楼兴园,引河桥北，京津公路西侧（北辰经济开发区对面）,普通住宅,9000
242,tj,枫水湾二期,西堤头镇东堤头村环龙商贸城北侧,普通住宅,5600
243,tj,海泰渤龙湾,高新区滨海科技园康泰大道9号,普通住宅,9000
244,tj,力高阳光海岸,滨海新区滨海旅游区航北路与湖滨路交口,普通住宅,6000
245,tj,天房雍阳府,武清区雍阳东道与团结路交口杨村师大旧址,普通住宅,7500
246,tj,天山御府,后营路与丰乐路交汇处（天山米立方东行500米）,别墅,200
247,tj,卓达镜湖,武清高村镇京津高速（二线）牛镇出口东行100米,别墅,8500
248,tj,卓达三溪塘,武清京津公路西侧,普通住宅,8000
249,tj,万城聚豪,京津公路沿线嘉河道123号,普通住宅,13200
250,tj,桃源观邸,滨海新区云山道与威海路交口,普通住宅,10000
251,tj,建投观海,塘沽天津大道与闸南路交口以东100米,普通住宅,8400
252,tj,富贵嘉园,塘沽新港路与新港一号路交口北侧,普通住宅,13500
253,tj,復康路十一號,复康路11号,普通住宅,65000
254,tj,富豪新开门,新开路与卫国道交口,普通住宅,30000
255,tj,宜禾红橡公园,中新生态城和顺路与和畅路交口,普通住宅,10000
256,tj,五矿榕园,津涞公路外环线出口1.2公里,别墅,500
257,tj,海泰软件园SOHO,华苑产业区海泰大道42号,商住两用,9464
258,tj,滨海浙商宜居,开发区轻轨站对面(津塘公路419号),商住两用,13000
259,tj,中国窗,南门外大街与南开五纬路交口西南侧（海光寺家乐福左行30米）,商住两用,20000
260,tj,昆仑中心,友谊北路58号（近永安道，乐购超市北侧）,商住两用,18000
261,tj,中山八号中山8克拉,中山北路8号（北宁公园南门对面）,商住两用,14000
262,tj,鑫谷园,津南辛庄镇天津大道与机场南沿线交口处,商住两用,9000
263,tj,巨福园公寓,新开路与华龙道交口（沃尔玛超市斜对面）,商住两用,13200
264,tj,万科城市之光,东丽成林道与国山路交口,普通住宅,18000
265,tj,贻成豪庭,塘沽塘汉路与云山道交口（交口的西北角处）,普通住宅,11000
266,tj,万科东丽湖鹭湖,东丽之光大道东丽湖万科城,普通住宅,8600
267,tj,华润橡树湾,华明镇弘泽大街与杨北公路交口,普通住宅,9500
268,tj,天津华侨城天鹅堡,东丽湖路以西，东丽之光大道以南,普通住宅,7000
269,tj,玺岳,河北大街与新三条石大街交口,普通住宅,28000
270,tj,中建滨海壹号,塘沽京津塘高速公路延长线与威海路交口,普通住宅,10500
271,tj,招商雍景湾,海河东路与海津大桥交口东侧,普通住宅,26000
272,tj,远雄兰苑,中新生态城和顺路与和韵路交口,普通住宅,12000
273,tj,宝龙城,滨海旅游区海旭道与安明路交口,普通住宅,8800
274,tj,荷塘悦色,杨柳青镇欣杨路121号（杨柳青镇政府西侧雅馨园旁）,普通住宅,12700
275,tj,贻成水木清华,滨海森林公园，滨海国际高尔夫球场旁,别墅,420
276,tj,保利溪湖林语,武清区南湖风景区天和道东侧,普通住宅,7000
277,tj,融创中央学府,天津大道与东沽路交口,普通住宅,13000
278,tj,城投熙和园,翠通路与光明道交口,普通住宅,11000
279,tj,嘉平8090,下朱庄街道办嘉平道北侧,普通住宅,7000
280,tj,旭日豪庭,石各庄镇杨王路西侧、北外环南侧,普通住宅,4600
281,tj,鸿坤原乡郡,高铁站向东1000米（泉昇中学东侧）,普通住宅,7500
282,tj,锦尚豪庭,津南小站镇前营路与正营道交汇处（紧邻小站练兵园）,普通住宅,7300
283,tj,天山龍玺,小站镇海世界米立方东侧,普通住宅,6200
284,tj,万辰金色家园,王庆坨镇政府西侧,普通住宅,6580
285,tj,盛世天下,雍阳西道与泉达路交口,普通住宅,9500
286,tj,天嘉湖花园,津港公路天嘉湖东侧,别墅,243
287,tj,鑫谷园,津南辛庄镇天津大道与机场南沿线交口处,别墅,270
288,tj,仁爱团泊湖逸湖岸,静海团泊新城仁爱大道西侧,别墅,6800
289,tj,滨海欣嘉园,京津高速北塘站出口杨北公路以北1公里处,普通住宅,5800
290,tj,绅湖公馆,港城大道滨海湖生态居住区,普通住宅,13000
291,tj,吉宝季景兰庭,中新生态城和旭路1189号（和旭路与和畅路交口）,普通住宅,7500
292,tj,南园,津港公路与科技大道交口西南侧,普通住宅,21000
293,tj,王顶堤故里,复康路与快速路交口（金冠里西侧）,普通住宅,8200
294,tj,帝达东谷国际,东丽开发区津塘路与五经路交口处,商住两用,35000
295,tj,津澜阙,台儿庄南路129号（台儿庄南路与古海道交汇处）,商住两用,13000
296,tj,信恒锦园,双港镇外环辅路与景盛路交口,商住两用,7000
297,tj,左右城,军粮城工业园区轻轨旁,商住两用,11000
298,tj,UPUP公寓,卫国道199号（卫国道与祁连路交口）,商住两用,13000
299,tj,海益国际,新技术产业园区华苑产业区榕苑路2号（复康路与榕苑路交口）,商住两用,13500
300,tj,矽谷港湾,昆仑北路快速路与满江东道交口前行100米,商住两用,15000
301,tj,力高阳光海岸,滨海新区滨海旅游区航北路与湖滨路交口,别墅,12000
302,tj,天骥筑璟,津汉公路与东丽湖路交口,普通住宅,6400
303,tj,天安数码城,赛达大道与柳口路交汇处(张家窝示范工业园靠近柳口路一侧),普通住宅,11000
304,tj,金隅满堂,中北镇万卉路与卉安道交口,别墅,550
305,tj,融创君澜,洞庭路向北泰达大学城旁,普通住宅,9000
