,城市,小区名,地址,住宅类型,均价
291,wh,二七新江岸生活广场,正义路与后湖五路交汇处（东方华府旁）,普通住宅,11000
292,wh,博学尚品,车城西路与博学路交汇处（湖锦酒楼旁）,商住两用,6700
293,wh,奥特莱斯V公寓,黄陂盘龙城经济开发区盘龙大道50号,商住两用,5800
294,wh,百步亭金桥汇II期,金桥大道绿色新都站旁,商住两用,11000
295,wh,小米公馆,雄楚大道杨家湾虎泉街228号,商住两用,13500
296,wh,星海虹城3期鸿玺公馆,洪山广场西侧300米处，星海路特1号 （2号线小龟山站出口）,商住两用,15500
297,wh,泰顺和商业中心,东西湖长青街107国道以南，高桥五路以西，台南一道以北,商住两用,4600
298,wh,常福国际商务广场,常福工业园常兴路与318国道交汇处（205公交站南）,商住两用,5700
299,wh,越秀星汇君泊C空间,塔子湖东路与健美路交汇处,商住两用,11500
300,wh,汉水新城中法印象,公交H101中法友谊大桥站旁,普通住宅,4200
301,wh,世茂云锦,白沙三路前行300米（白沙三路以南、青菱西路以西）,普通住宅,9000
302,wh,CBD楚世家,武汉中央商务区建设大道181号(海军工程大学对面),普通住宅,23000
303,wh,海山幸福湾,袁家台（新农三官村附近）,普通住宅,4300
304,wh,学府丽城,博艺路（江大5号门）,普通住宅,6100
305,wh,龙山观邸,江夏纸坊街青龙路（青龙水库旁）,普通住宅,5750
306,wh,东西湖中心广场,东西湖五环路与东吴大道交界处（北冰洋城市广场旁）,普通住宅,9250
307,wh,东港国际广场,客运站旁,普通住宅,4000
308,wh,欣隆湖滨半岛,武汉阳逻街新施公路以南余泊路以东,普通住宅,4100
309,wh,祥和世纪城,紧邻人民广场、祥和集团对面,普通住宅,3900
310,wh,卧龙墨水湖边,江城大道与墨水湖南路交汇处,普通住宅,11000
311,wh,华润悦府,张之洞公园旁,普通住宅,18000
312,wh,中城悦城,武汉市江汉区发展大道与振兴三路交汇处,普通住宅,19500
313,wh,华享雕墅,江岸正义路12号江岸法院旁,普通住宅,10000
314,wh,新澳城市印象,汉施公路与余泊路交汇处,普通住宅,4600
315,wh,天悦尚景,新荣村客运站旁,普通住宅,12000
316,wh,汉江湾壹号,武汉市硚口区解放大道与古田一路交汇处,普通住宅,12500
317,wh,宝业光谷丽都,东湖高新区龙城路9号,普通住宅,10000
318,wh,永丰清华园,武汉市汉南区兴城大道与月亮湾路交汇处,普通住宅,3900
319,wh,南湖半岛,名都花园后618终点站,普通住宅,15000
320,wh,绿地香树花城,青山公园前和平大道与建设11路交汇处,普通住宅,8000
321,wh,天纵半岛蓝湾,宏图大道与银潭路交汇处（296金银潭大道宏图路站）,普通住宅,8000
322,wh,永辉茗筑,文昌街与影讯里交汇处（莲花湖畔）,普通住宅,4600
323,wh,越秀星汇云锦,中山大道1号,普通住宅,24000
324,wh,驿山高尔夫,武汉市东湖高新区高新大道789号,别墅,290
325,wh,纳帕溪谷,藏龙岛栗庙路9号(华农楚天学院旁),别墅,390
326,wh,融侨悦府,友谊大道与二环线交汇处（柴林花园站旁）,普通住宅,13000
327,wh,亿达云山湖,花城大道9号(软件新城公交站旁),普通住宅,7800
328,wh,七星富利天城,建设十路与红钢二街交汇处,普通住宅,9000
329,wh,韵湖星光,华师一附中旁,商住两用,9500
330,wh,新城阳光国际广场一期国创星寓,四新大道与芳草路交汇处（新区公园以东500米）,商住两用,9200
331,wh,天汇龙城二期,盘龙城巨龙大道90号（中百仓储旁）,普通住宅,6350
332,wh,中国核建锦城,汉阳大道中核世纪广场对面,普通住宅,5300
333,wh,东湖楚天府,八一路340号,商住两用,18500
334,wh,西山林语,恒大绿洲对面,商住两用,7500
335,wh,碧桂园学府壹号,蔡甸大街（蔡甸汉阳一中对面）,普通住宅,6200
336,wh,绿地珑墅,江城大道与四新大道交汇处前行800米,别墅,280
337,wh,联泰香域水岸,青山临江大道与建设四路交汇处,普通住宅,13800
338,wh,悦达新天地,友谊大道与工业三路交汇处,普通住宅,9400
339,wh,金地澜菲溪岸,江城大道与中环线交汇处,普通住宅,11000
340,wh,江南新天地,华师汉口分校南行200米,普通住宅,8500
341,wh,奥山世纪城CC尚品,青山二七大桥与和平大道交汇处（二七大桥南岸）,普通住宅,16000
342,wh,顺民宜盛花园,黄龙山隧道旁,普通住宅,8600
343,wh,绿地中央广场,江城大道与四新大道交汇处前行800米（三环线方向）,普通住宅,9200
344,wh,光谷自由城,民族大道与水蓝路交汇处（城铁南湖东站旁）,普通住宅,8500
345,wh,江滩花园,蔡河街与五层街交汇处（江滩公园正对面）,普通住宅,4100
346,wh,和昌森林湖,芳草路与汉新大道交汇处,普通住宅,14000
347,wh,佳兆业滨江壹号,琴台大道郭家湾车站附近,普通住宅,8800
348,wh,黄陂春天,黄陂前川街向阳村（板桥大道西黄陂六中斜对面）,普通住宅,50
349,wh,幸福湾,解放大道与堤边路交汇处,普通住宅,10000
350,wh,融侨城,和平大道铁机路,普通住宅,16000
351,wh,汉口湖畔,盘龙城经济开发区盘龙大道（奥特莱斯旁）,普通住宅,6800
352,wh,世纪万通漫谷,天鹅湖大道（千年美丽旁）,普通住宅,5200
353,wh,玉金山墅,武汉市蔡甸区索河镇金龙水寨,别墅,78
354,wh,伊托邦麓山郡,五里界大道和伊托邦大道交汇处,别墅,63
355,wh,汇悦天地,后湖华岭路与健康街交汇处（武汉市民之家旁）,普通住宅,11500
356,wh,王家湾中央生活区,王家湾（武汉老交管局西侧）,普通住宅,9800
357,wh,紫菘中南特区,丁字桥与文安街交汇处，锦江之星酒店对面,普通住宅,14700
358,wh,红枫金座,武汉职业技术学院对面,商住两用,15000
359,wh,武久阳光城,阳逻环湖路（柴泊湖广场对面）,普通住宅,4000
360,wh,金融街壹号,建设大道与黄浦大街交汇处（3号、8号地铁上盖）,普通住宅,18500
361,wh,香榭花都三期领域,新洲区新城柴泊湖以北（近阳发路）,普通住宅,4400
362,wh,万科翡翠国际,建设大道长江日报路79号,普通住宅,25000
363,wh,紫轩时代广场,汉施大道与立山路口交汇处（幼师专科学校对面）,普通住宅,4500
364,wh,江北豪庭,梅教街与汉施公路交汇处（红村小学附近）,普通住宅,4500
365,wh,兴华御水澜湾,墨水湖南路与连通港路交汇处,普通住宅,8400
366,wh,金湖听语,金山大道·地铁6号线假日广场站（金银湖南一街与环湖西路交汇处）,普通住宅,9400
367,wh,武汉恒大龙墅,巨龙大道兴龙路口（佳海工业园附近）,别墅,13500
368,wh,恒大常青花园,常青花园6号,普通住宅,10500
369,wh,联投半岛,车城西路与车城大道交汇处（经开职业学校附近）,别墅,300
370,wh,普提金街,雄楚大街与桂元路交汇处,普通住宅,60
